[
  {
    "id": "african-bush-elephant",
    "name": "African bush elephant",
    "kind": "animal",
    "category": "megafauna",
    "icon": "🐘",
    "representative_peak_mass_kg": 6500,
    "body_length_m": 7.5,
    "shoulder_or_body_height_m": 3.8,
    "burst_speed_kph": 40,
    "effective_reach_m": 3.0,
    "attack": 91,
    "defense": 94,
    "durability": 96,
    "agility": 35,
    "stamina": 82,
    "intelligence": 60,
    "aggression": 65,
    "coordination": 68,
    "morale": 88,
    "armor": 78,
    "multi_target": 72,
    "habitats": [
      "savanna",
      "open"
    ],
    "attack_modes": [
      "tusk",
      "trample",
      "charge"
    ],
    "traits": [
      "thick-hide",
      "herd"
    ],
    "data_confidence": "high",
    "source_label": "Orientation reference; production values require expert review",
    "source_url": "https://en.wikipedia.org/wiki/African_bush_elephant",
    "model_notes": "Representative high-end adult profile; normalized combat scores are model inputs, not direct zoological measurements.",
    "can_fly": false,
    "aquatic": false,
    "venomous": false,
    "ranged": false,
    "regenerates": false,
    "undead_or_construct": false
  },
  {
    "id": "asian-elephant",
    "name": "Asian elephant",
    "kind": "animal",
    "category": "megafauna",
    "icon": "🐘",
    "representative_peak_mass_kg": 5400,
    "body_length_m": 6.4,
    "shoulder_or_body_height_m": 3.2,
    "burst_speed_kph": 40,
    "effective_reach_m": 2.7,
    "attack": 88,
    "defense": 92,
    "durability": 94,
    "agility": 38,
    "stamina": 82,
    "intelligence": 62,
    "aggression": 62,
    "coordination": 70,
    "morale": 88,
    "armor": 76,
    "multi_target": 70,
    "habitats": [
      "forest",
      "savanna"
    ],
    "attack_modes": [
      "tusk",
      "trample",
      "charge"
    ],
    "traits": [
      "thick-hide",
      "herd"
    ],
    "data_confidence": "high",
    "source_label": "Orientation reference; production values require expert review",
    "source_url": "https://en.wikipedia.org/wiki/Asian_elephant",
    "model_notes": "Representative high-end adult profile; normalized combat scores are model inputs, not direct zoological measurements.",
    "can_fly": false,
    "aquatic": false,
    "venomous": false,
    "ranged": false,
    "regenerates": false,
    "undead_or_construct": false
  },
  {
    "id": "white-rhinoceros",
    "name": "White rhinoceros",
    "kind": "animal",
    "category": "megafauna",
    "icon": "🦏",
    "representative_peak_mass_kg": 2300,
    "body_length_m": 4.2,
    "shoulder_or_body_height_m": 1.85,
    "burst_speed_kph": 50,
    "effective_reach_m": 2.2,
    "attack": 90,
    "defense": 92,
    "durability": 92,
    "agility": 47,
    "stamina": 70,
    "intelligence": 35,
    "aggression": 78,
    "coordination": 38,
    "morale": 90,
    "armor": 88,
    "multi_target": 62,
    "habitats": [
      "savanna",
      "open"
    ],
    "attack_modes": [
      "horn",
      "charge",
      "trample"
    ],
    "traits": [
      "thick-hide"
    ],
    "data_confidence": "high",
    "source_label": "Orientation reference; production values require expert review",
    "source_url": "https://en.wikipedia.org/wiki/White_rhinoceros",
    "model_notes": "Representative high-end adult profile; normalized combat scores are model inputs, not direct zoological measurements.",
    "can_fly": false,
    "aquatic": false,
    "venomous": false,
    "ranged": false,
    "regenerates": false,
    "undead_or_construct": false
  },
  {
    "id": "hippopotamus",
    "name": "Hippopotamus",
    "kind": "animal",
    "category": "megafauna",
    "icon": "🦛",
    "representative_peak_mass_kg": 3200,
    "body_length_m": 4.9,
    "shoulder_or_body_height_m": 1.6,
    "burst_speed_kph": 30,
    "effective_reach_m": 1.7,
    "attack": 94,
    "defense": 92,
    "durability": 95,
    "agility": 42,
    "stamina": 72,
    "intelligence": 45,
    "aggression": 92,
    "coordination": 42,
    "morale": 91,
    "armor": 76,
    "multi_target": 65,
    "habitats": [
      "river",
      "swamp",
      "savanna"
    ],
    "attack_modes": [
      "bite",
      "charge",
      "crush"
    ],
    "traits": [
      "amphibious",
      "thick-hide"
    ],
    "data_confidence": "high",
    "source_label": "Orientation reference; production values require expert review",
    "source_url": "https://en.wikipedia.org/wiki/Hippopotamus",
    "model_notes": "Representative high-end adult profile; normalized combat scores are model inputs, not direct zoological measurements.",
    "can_fly": false,
    "aquatic": false,
    "venomous": false,
    "ranged": false,
    "regenerates": false,
    "undead_or_construct": false
  },
  {
    "id": "giraffe",
    "name": "Giraffe",
    "kind": "animal",
    "category": "megafauna",
    "icon": "🦒",
    "representative_peak_mass_kg": 1200,
    "body_length_m": 5.5,
    "shoulder_or_body_height_m": 5.3,
    "burst_speed_kph": 60,
    "effective_reach_m": 2.8,
    "attack": 79,
    "defense": 66,
    "durability": 74,
    "agility": 55,
    "stamina": 68,
    "intelligence": 45,
    "aggression": 55,
    "coordination": 42,
    "morale": 76,
    "armor": 34,
    "multi_target": 58,
    "habitats": [
      "savanna",
      "open"
    ],
    "attack_modes": [
      "kick",
      "stomp",
      "neck-swing"
    ],
    "traits": [
      "height"
    ],
    "data_confidence": "high",
    "source_label": "Orientation reference; production values require expert review",
    "source_url": "https://en.wikipedia.org/wiki/Giraffe",
    "model_notes": "Representative high-end adult profile; normalized combat scores are model inputs, not direct zoological measurements.",
    "can_fly": false,
    "aquatic": false,
    "venomous": false,
    "ranged": false,
    "regenerates": false,
    "undead_or_construct": false
  },
  {
    "id": "cape-buffalo",
    "name": "Cape buffalo",
    "kind": "animal",
    "category": "large-herbivore",
    "icon": "🐃",
    "representative_peak_mass_kg": 900,
    "body_length_m": 3.4,
    "shoulder_or_body_height_m": 1.7,
    "burst_speed_kph": 57,
    "effective_reach_m": 1.5,
    "attack": 84,
    "defense": 82,
    "durability": 84,
    "agility": 52,
    "stamina": 78,
    "intelligence": 42,
    "aggression": 84,
    "coordination": 65,
    "morale": 90,
    "armor": 66,
    "multi_target": 58,
    "habitats": [
      "savanna",
      "open"
    ],
    "attack_modes": [
      "horn",
      "charge",
      "trample"
    ],
    "traits": [
      "herd"
    ],
    "data_confidence": "high",
    "source_label": "Orientation reference; production values require expert review",
    "source_url": "https://en.wikipedia.org/wiki/African_buffalo",
    "model_notes": "Representative high-end adult profile; normalized combat scores are model inputs, not direct zoological measurements.",
    "can_fly": false,
    "aquatic": false,
    "venomous": false,
    "ranged": false,
    "regenerates": false,
    "undead_or_construct": false
  },
  {
    "id": "moose",
    "name": "Moose",
    "kind": "animal",
    "category": "large-herbivore",
    "icon": "🫎",
    "representative_peak_mass_kg": 700,
    "body_length_m": 3.1,
    "shoulder_or_body_height_m": 2.1,
    "burst_speed_kph": 56,
    "effective_reach_m": 1.8,
    "attack": 77,
    "defense": 70,
    "durability": 76,
    "agility": 54,
    "stamina": 72,
    "intelligence": 40,
    "aggression": 65,
    "coordination": 35,
    "morale": 78,
    "armor": 45,
    "multi_target": 55,
    "habitats": [
      "forest",
      "snow",
      "swamp"
    ],
    "attack_modes": [
      "antler",
      "kick",
      "charge"
    ],
    "traits": [
      "cold-adapted",
      "swimmer"
    ],
    "data_confidence": "high",
    "source_label": "Orientation reference; production values require expert review",
    "source_url": "https://en.wikipedia.org/wiki/Moose",
    "model_notes": "Representative high-end adult profile; normalized combat scores are model inputs, not direct zoological measurements.",
    "can_fly": false,
    "aquatic": false,
    "venomous": false,
    "ranged": false,
    "regenerates": false,
    "undead_or_construct": false
  },
  {
    "id": "elk",
    "name": "Elk",
    "kind": "animal",
    "category": "large-herbivore",
    "icon": "🦌",
    "representative_peak_mass_kg": 480,
    "body_length_m": 2.7,
    "shoulder_or_body_height_m": 1.55,
    "burst_speed_kph": 64,
    "effective_reach_m": 1.5,
    "attack": 70,
    "defense": 61,
    "durability": 68,
    "agility": 61,
    "stamina": 74,
    "intelligence": 40,
    "aggression": 58,
    "coordination": 48,
    "morale": 73,
    "armor": 32,
    "multi_target": 52,
    "habitats": [
      "forest",
      "open"
    ],
    "attack_modes": [
      "antler",
      "kick",
      "charge"
    ],
    "traits": [
      "herd"
    ],
    "data_confidence": "high",
    "source_label": "Orientation reference; production values require expert review",
    "source_url": "https://en.wikipedia.org/wiki/Elk",
    "model_notes": "Representative high-end adult profile; normalized combat scores are model inputs, not direct zoological measurements.",
    "can_fly": false,
    "aquatic": false,
    "venomous": false,
    "ranged": false,
    "regenerates": false,
    "undead_or_construct": false
  },
  {
    "id": "horse",
    "name": "Horse",
    "kind": "animal",
    "category": "domestic",
    "icon": "🐎",
    "representative_peak_mass_kg": 600,
    "body_length_m": 2.5,
    "shoulder_or_body_height_m": 1.7,
    "burst_speed_kph": 70,
    "effective_reach_m": 1.4,
    "attack": 71,
    "defense": 58,
    "durability": 68,
    "agility": 67,
    "stamina": 80,
    "intelligence": 48,
    "aggression": 45,
    "coordination": 62,
    "morale": 68,
    "armor": 24,
    "multi_target": 47,
    "habitats": [
      "open",
      "farm"
    ],
    "attack_modes": [
      "kick",
      "bite",
      "trample"
    ],
    "traits": [